{
  "schema_version": "1.0.0",
  "receipt_id": "H4d1a-PRIDHAM-SOURCE-REBINDING-20260811",
  "atom_id": "H4d1a",
  "recorded_at": "2026-08-11T13:02:59+00:00",
  "withdrawn_source": {
    "arxiv_id": "1112.6001v4",
    "title": "Semiregularity via derived deformation theory",
    "status": "WITHDRAWN",
    "url": "https://arxiv.org/abs/1112.6001",
    "withdrawal_reason": "Withdrawn - superseded by arXiv:1208.3111 (v3 contained errors in the formulae for the Goodwillie-Jones Chern character, and the key lemma, Prop 1.21, turns out to be Goodwillie's theorem on nilpotent ideals)",
    "superseded_by": "1208.3111v4",
    "retrieved_at": "2026-08-11T13:02:49+00:00",
    "retrieved_content_sha256": "sha256:d28747db1d530d17cb09aedb68a5d3859c7066da0ff26bb5553511debf14a350",
    "retrieval_url": "https://arxiv.org/abs/1112.6001"
  },
  "current_source": {
    "arxiv_id": "1208.3111v4",
    "title": "Semiregularity as a consequence of Goodwillie's theorem",
    "author": "J. P. Pridham",
    "status": "CURRENT",
    "url": "https://arxiv.org/abs/1208.3111v4",
    "supersedes": "1112.6001v4",
    "source_comment": "22 pages, supersedes arXiv:1112.6001",
    "retrieved_at": "2026-08-11T13:02:49+00:00",
    "retrieved_content_sha256": "sha256:cf35e4d017cfb12c4ab34755485824ec8ab5bf57b1f8761c3b83931951ef4f8a",
    "retrieval_url": "https://export.arxiv.org/api/query?id_list=1208.3111"
  },
  "authority_rebinding": {
    "active_primary_source": "1208.3111v4",
    "historical_source_authority": "QUARANTINED_WITHDRAWN_PROVENANCE_ONLY",
    "retrospective_claim_expansion_allowed": false,
    "effect": "SOURCE_VERSION_CORRECTION_ONLY"
  },
  "claim_scope": [
    "The current source may support only claims actually verified against arXiv:1208.3111v4.",
    "The withdrawn predecessor remains visible only to preserve provenance of the historical packet.",
    "This rebinding does not create Hodge-root, novelty, proof, higher-order, or independent-review authority."
  ],
  "evidence_pointers": [
    "https://arxiv.org/abs/1112.6001",
    "https://arxiv.org/abs/1208.3111v4",
    "https://export.arxiv.org/api/query?id_list=1208.3111",
    "sha256:d28747db1d530d17cb09aedb68a5d3859c7066da0ff26bb5553511debf14a350",
    "sha256:cf35e4d017cfb12c4ab34755485824ec8ab5bf57b1f8761c3b83931951ef4f8a"
  ],
  "artifact_hash": "sha256:2e2eed5700c279e391bb52576ba929ade17082c70822d1269c60ebd2fbaa0048"
}
